{"intent_id":"critic2-disc-add-1","kind":"CONSEQUENTIAL_CASE","action_name":"ADD_DISCRETIONARY_WORK","target_object_id":"","case_id":"case_20260926T014412Z_1b967f","client_cursor":"01M3DP4QQFK8BEB1SQRCT4DX8K","actor":{"actor_id":"operator_local","role":"operator"},"parameters":{"case_id":"case_20260926T014412Z_1b967f","stage_id":"task_prepare","kind":"sandboxed_task","title":"Critic2 Augmented Notes","summary":"Critic2 discretionary note body.","justification":"Independent critic proof that the served surface produces an accepted kernel write."}}
